,post_id,source,text,tags,post_date,url,n_notes,likes,rebloggers,rebloged_from,user
0,186654647858,j-uwu-ish,"I just think it’s really interesting that once I became more visibly Jewish- wearing a tichel or kippah on a daily basis, wearing my hamsa, learning Yiddish- I was immediately faced with (misdirected) transmisogyny- being called transmisogynistic specific slurs, being followed and harrassed off buses, being followed and watched in women’s bathrooms, etc.
It goes to show that transmisogynists and terfs base their ideas on what womanhood is on a white, European, racist, antisemetic, patriarchal caricature of womanhood, and not actual womanhood, which is intrisic to each women, normal or cis., Hey people w morals! Could you reblog this so I have non terfs in the notes and spread awareness? Thank you kindly!",,"31,654 notes, 31,654 notes, , ","https://queer-no-matter-what.tumblr.com/post/186654647858/i-just-think-its-really-interesting-that-once-i/embed, https://queer-no-matter-what.tumblr.com/post/186654647858/i-just-think-its-really-interesting-that-once-i","31,654 notes","notherefortheanonhate, carol-ing, algoliangambol, salamander-sorcerer, crowleysange, gothgayscientist, yes-and-yes-and-no, lily-less, swimmingbirdrunningrock, brumastequio, spiderlingkittens, rhinefall, aminamithri, rollerskatinglizard, mynameis3-14, debonairmalchick, justforbadness, sumoranges, doodled93, natandacat, arjache, theshortbuthappyone, genericharrypotterurl, ayyysexual, phillipstaysalive, zaneplodes, crimethic, dovakiin112858, apocalypsefollower, flamingoslikechocolatecake, itsthemoooooooooon, primtheamazing, opinionatedgirlsday, theirrationalfan, mochakamera97, vikith21, koohiss, nevichaos, brightnessdavar, babyhubris, jcogitae-blog, sloth-fossil, loxleypendragon, joestrummen, velante, hellfirepheonixx, personinthehat, shadesofmelancholy, wolfgargojira, awlwren, ileza, thegirlwithtoomanybooks, astercrash, muffinstick, pariwinkle2428, spring-fey, w01fpacc, ericthearchmage, kirliq, polkadot-flannel, cthulhubert, ari-s-p-e-c-t, ourladyoflazarus, psychoticsherlockian, kttngrl, wrongyetentertaining, magicspellsprotectiveshells, lordmushroomkat, toxxik-shock, chimericaloutlier, sakon76, izzy-cat, seagulls-corner, gd-gone, ughryn, dissonant-cognition, actslikeacat, queeninmyrealm, closerundone, bluespacebeudy, jadezaera, imagine-hodgepodge, space-parasite, kaybirdie512, nightshadeis, the44th, eggspertly, drownedduck, patchy-works, cutelilfish, bobolovesoze, amphibiousfae, janzoo, belovedknight, weresehlat, stuffoverthechocolate, concernedcatlady, raavynndigital, haha-leigh, blablarobinrosebla, groot-scamander, thelordofabsolutelynothing, herfriendponyshoe, rehks-the-mess, rdx-dcm, anxiousanura, ladyoftheshield, bubblegum-monroe, kahki820, lana--22, i-wakeupstrange, firestarbb, maskedquerade, purplefishies007, alliharkness, honeymilk-witch, sabotflask, witchyfeministpanda, heavyvapor, useless-asexual273, imgoingtogobacktheresomeday, literally-just-sitting-here, septic-angst-queen, rosescarves, valkyrieninja, draenar, samjohnssonvt, writing-is-my-game, simons-saying, shadowwingwitch, death-is-my-way-of-life, cosmic-geologist, whizz-in-my-ass, definitely-not-an-alias, lynn-walker, mjstborn, sarcasrnspasrn, joekanji, devifablekatze, insertfandomnmehere, questioningcorgi, bromocresol0green, howieduet, everythingisallegory, redrossesandbluethorns, snowspine, damnsmartblueboxes, oracaleangellia, lights-all-askew, much-the-millers-kid, makeitwrite, officialclarith, leahweird, gunsandhope, beenabutterandjelly, redwoods301, bishoparmester, sinbadism, starless-dark, brokenboss, jimhensonreject, unpretty, fiascodownunder, stechpalmeglocke, low-on-memory-storage, slipperyslideyday, newbornnebulae, hamiltonsdecisionmakingskills, whomstkilledthegods, insanitysending, catmeowsalot, lightnin-ina-bottle, walamacada, quietlikeacandle, spingtail, olivesandcheese, knisterklee, robloxoofsoundbutbassboosted, happyallykats, luckbloom, astroremkinesis, pastelskydream, everphantom, writersine, wigbeats, beach-fan, thealphabetmurders, goghartho, faltadoquefazer, dodgernic, anoodlebird, startingfine, cheekeykane, ariecide, kiingcorobo, heroeshavedied, clmorsefiction, elektra-phi-beta, granola-cakes, thepositives1, tragedylost, that-one-kid-i-dont-like, grldrool, cypriusgray","notherefortheanonhate, ceilingpepper, justsomeblogger, graysonisgay, devilg0th, salamander-sorcerer, gothgayscientist, yes-and-yes-and-no, swimmingbirdrunningrock, diabetic-cactus, queerestunicorn, orangesoda2012, bubblegum-monroe, spiderlingkittens, mintcraft, mynameis3-14, debonairmalchick, warrenkoles, bluesubstitute, jordemme, novaslammer, chimchar-the-anti, idk-my-aesthetic, xmasuchii, montgomeryzuma, captainkay, ayyysexual, jebus0, lonkku, nvld-memes, itsthemoooooooooon, opinionatedgirlsday, theirrationalfan, causetheworldexistsandsodopeople, vikith21, fluidityandgiggles, nevichaos, brightnessdavar, incompetentambulist, awkwardnumber-ofdinos, torrilin, thetigerbutlolcheezits, nihilistic-rabbit, ericthearchmage, kttngrl, bottled-star27, magicspellsprotectiveshells, lordmushroomkat, toxxik-shock, seagulls-corner, jinxwild19, anonymous-thoughts-and-opinions, actslikeacat, tl-c-sugarskulls, the44th, clumsyhatter, cutelilfish, baron-von-fancy, belovedknight, marskittlesglitter, stuffoverthechocolate, kris-10s-blog, heydudestisi, ladlightfoot, anxiousanura, elkian, thelordofabsolutelynothing, rehks-the-mess, thisishowwedonut, donutcourse, goodonebadgirl, bubblegum-monroe, lierrenymphe, firestarbb, themoontheinconstantmoon, alliharkness, tinytinyrobot, mypointremains, sentient-orsomethingorother, ghoulfr13nd, imgoingtogobacktheresomeday, tape-6, solitarelee, beatrice-otter, dragonictitan, awellwrittenlie, definitely-not-an-alias, ewitsemile, devifablekatze, m3rkury, ibasicallyjustreblogeverything, greggrimmaldisowesme15dollars, much-the-millers-kid, officialclarith, clumsyhatter, hopeful-bee, broadwaytheanimatedseries, wisowind, unpretty, doubleknit-dice, thatonesleepyperson, low-on-memory-storage, architeuthisducks-blog, golden-chocolate-demon, princess-charmingx, miscellaneous-ness, insanitysending, catmeowsalot, diabolicpants, corvidity, lightnin-ina-bottle, walamacada, carmendementiae, tiredtree, spingtail, bispotti, turqouis, darklordpatricia, changky-n, seidou-chan, mihhashi, hunnybearrrr, pastelskydream, coccolotti, hitodena, mistresssasori, moslyrian-life, thealphabetmurders, roseblows, memes-and-anger, sparklingly-defective, dodgernic, thelimeadecat, serowey, cbear-wolfie, birdynoodle, hon3ys, startingfine, that-one-kid-i-dont-like, superfunfandomfan, curlypuff99, clmorsefiction, heroeshavedied, cypriusgray, m9tild9, j-uwu-ish","unpretty, mintcraft, graysonisgay, j-uwu-ish, swimmingbirdrunningrock, debonairmalchick, bubblegum-monroe, debonairmalchick, unpretty, mintcraft, mynameis3-14, mintcraft, mynameis3-14, bluesubstitute, broliloquy, debonairmalchick, bluesubstitute, a-good-sweet-boy, reddurcs, xmasuchii, xmasuchii, unpretty, unpretty, philalethistry, unpretty, unpretty, unpretty, cipheramnesia, unpretty, fluidityandgiggles, fluidityandgiggles, theirrationalfan, unpretty, fluidityandgiggles, fluidityandgiggles, broadwaytheanimatedseries, unpretty, incompetentambulist, unpretty, unpretty, unpretty, unpretty, tinytinyrobot, solitarelee, unpretty, rosejutsu, unpretty, broadwaytheanimatedseries, unpretty, unpretty, unpretty, unpretty, rehks-the-mess, unpretty, alliharkness, unpretty, unpretty, unpretty, unpretty, imgoingtogobacktheresomeday, unpretty, aliensmoothie-gotta-blast, aliensmoothie-gotta-blast, unpretty, unpretty, unpretty, unpretty, broadwaytheanimatedseries, definitely-not-an-alias, definitely-not-an-alias, broadwaytheanimatedseries, wisowind, unpretty, tinytinyrobot, unpretty, unpretty, unpretty, unpretty, unpretty, unpretty, unpretty, unpretty, unpretty, unpretty, unpretty, unpretty, unpretty, broadwaytheanimatedseries, unpretty, unpretty, broadwaytheanimatedseries, unpretty, broadwaytheanimatedseries, unpretty, unpretty, broadwaytheanimatedseries, unpretty, unpretty, j-uwu-ish, architeuthisducks-blog, memes-and-anger, princess-charmingx, broliloquy, princess-charmingx, sunstar121, walamacada, diabolicpants, monsterkitties, twunkgambit, spingtail, 50shades-of-blue, 50shades-of-blue, spingtail, bispotti, darklordpatricia, hitodena, changky-n, monsterkitties, seidou-chan, h0neyteasupremacy, hunnybearrrr, hitodena, toonytalks, hitodena, covet, no-soul-no-problems, thelimeadecat, sparklingly-defective, castlevania, multishipping-goodness, thelimeadecat, wednesdayzz, multishipping-goodness, covet, monsterkitties, monsterkitties, candlesnuff, monsterkitties, monsterkitties, my-writings-and-musings, monsterkitties, comickit, comickit, violetutterances, covet, this",queer-no-matter-what
0,186619692423,meshkwahkihaki,"idk what shit-eating truscum needs to hear this, but your rhetoric directly harms people with culturally-specific genders. i’m native and two-spirit, that label describes my gender and my attraction. i use they/them pronouns and your “nonbinaries and cringey stargender trenders aren’t valid” bullshit is getting old. our languages were demonized and erased, our gender and attraction labels along with them. my experiences with dysphoria exist because of colonialist ideas of gender. we have been forced into arbitrary ‘male’ and ‘female’ categories by colonizers for centuries and truscum rhetoric perpetuates racist colonialist violence against natives.
your experiences are not universal, you’re not forwarding justice for trans people, and you’re definitely not an ally to natives or other people of color. you’re just a fucking colonizer. , non-natives, reblog this post",,"33,717 notes, 33,717 notes, , ","https://queer-no-matter-what.tumblr.com/post/186619692423/idk-what-shit-eating-truscum-needs-to-hear-this/embed, https://queer-no-matter-what.tumblr.com/post/186619692423/idk-what-shit-eating-truscum-needs-to-hear-this","33,718 notes","knightndayart, mrspooock, katsumiri, dragon-puns, myworldincolor, asstronut420, belgii-chan, starchild-x, sunnystrawb, unfortunateseriesof, plsnooneiknowfindme, razorkillrabbits, rodimusgundam, potatanoes, thatsexyspoonie, myrriden, transmigrationmacabre, raqhaelia, elsterz, non-exclusive-trash, suicide-edition, lilleeboi, highlightingthestars, karenelizabeth42, mechanicalsatanical, burntblackfeathers, thranduil-aran-edhil, silverhawk88, wisconsinoctopus, powerxdeath, tiredandangry, ctromedea, the-ambitious-avocado, super-serket-spider-troll, talkinaboutwhatiknowabout, sunxcherries, gostarflyer, jembanesayshello, n0b0dy78, artsysquiddles, airogrup, treazuregoblin, a-croissant, viciouslunatic, holy-mountaineering, happilyetherafter, immoralgays, chibidragonchan, thoughtfullandfriendbandit, ofwoeorwonder, simenhd-blog, chiefcashponygoop, photographybear, 17cherrys, reverend-sean, foodscarf, ivarrboneless, vulpeccula, teagoblin, wlwlovingloki, tokki-bb, captain-feather, 123booyakasha, nianeurotic, hummingbird-hooligan, cactuspeake, justplainsimon, narithegay, spacehunter-m, lady-tabris, op-peccatori, auttoton, awinchestershell, mybodyismadeofstars, demon-duck-named-darcey, k1ngtok1, lunelily, lovelytiefling, pippip-cheerio, serenacanlive, mateodoodle, crocodilebutch, chandelegion13, gayspacemom22, spxcesuits, biswedishgirl, skeletondragon, ameliafromafairytale, silver-tigress, bisexualr2d2, faraday-cage, opalescent-potato, coffeespotcowboy, anxiousdemifaemess, the44th, brownbearhoopla, cadenboy456, lordchao, triplet-vo, alliharkness, littlelesbianlampost, w3th3drown3d, moonflowero1, zang269, violettherainwing, ghost-zoast, monde-de-gris, 9urplehoodie, furbtech, digitalcactii, kayoss-theerie, awishturnedwell, sun-dollars, tofu-pofu, noroquian, triple-emotion, hopeful-gaming1205, overtherainbow-underthesea, dasbender, crankthatyee, eenomoto, whalesarefromspace, lee-fletcher, gorgeousgalatea, sylvie-the-furry, roadhogs-husband, lazydaygray, fanbott, socks-bog-wench, tigerstripedmoon, grannygoodtea, whycellothurr, murtogg, demisexualaziraphale, calisotalatina, majestic-training-wheels, ivory-obituary, stupidly-curious-at-best, lovelessbby, aro-ace-from-outer-space22, aquietanarchy, sincitysgreatesthits, malaxis, parabailarlabanba, neighdeathneverstopyou, lategreatleo, gatheringlotuses, magnetmoose, tonicsoldier, princessknightt, supersoftie, trenderpigeon, tindog47, gay2kornee, stoney-tex-angel, guenifhar, justaboredmind, spacemoonsam, rynnieunnie, sad-but-lovely, kieranczy, mikia5, the-uhh-dragon, your-physical-apathy, slow-dance-in-the-dark, mrrrl, madswantstofight, femtyranny, flurry-of-beaus, mickeyschwartz, lesbianisopod, wrenvibes, lasilhouetteinbianco, livinglifetotheminimum, snapback-gravity-falls, maziedecrazie, bamboozled-rainbow-cheesecake, yukineko-kitty-chan, oxromeoxo, kingsandqueensinej, emilion-screeches, thevoidsflame, silverliningslurk, pyroskinesis, nizhonigo, rockcandey, bunnibelle, palmetto-ravens, ferrasspace, honeybaublebee, cydanite, the-fairy-dong-mother, darkkittymews, invisiblesocks, nondysphoric-enby, noxpotion, hunchpop, bigtiddygothvvitch, bookkeeperamanda, 21cannibal, thegreatspain, tomorrowgirls, tutmodic, cryptidracccoon, pastelpinkpills, nonbinarydrflug, bonchwad, nerdy-lesbian-musician-bihh, hulk-janitor, boatsandmermaids, cherry7-up, black-and-white-horror, alovenymph, shakesphereanqueerian, raydrachen, randommagikarp","rachhudsonberry, oomcheck, frost-moons, supazupa, katsumiri, dragon-puns, shevi-hime, lan-i, princenwitch, caprigender, belgii-chan, finder-of-rings, theo-aka-birdie, sunnystrawb, unfortunateseriesof, luzisdumb, oniongrass, razorkillrabbits, literallyconfusedmrkrabs, rodimusgundam, potatanoes, gay-decepticon, my-minds-eye-perspective, transmigrationmacabre, elsterz, pigeonreligeon, lilleeboi, cutmefromthelight, iammyselfiamme, readingwarrior17, justadamfan, karenelizabeth42, utopiospherian, chemiosmotic, zidane-xv, cat-babel, mojavejourneys, twostringsandme, tiredandangry, asexualfennekin, angryfeministdyke, nicknaklmao, notalwaysweak, ctromedea, belligerent-pacifist, jay-jay-the-jet-plane-lgbt, ephemyral, choco-myth, super-serket-spider-troll, erroneousmonk, talkinaboutwhatiknowabout, oriionsbelt, cats--and--feminism, em-thenerd, artsysquiddles, mahalidael, wormlad, womenofultron, peppergoji, viciouslunatic, working-class-wizard, buttphomet, happilyetherafter, newdriscollgirl, hey-higglehiddle, pipuridaze, bitronic, 21-7-2003, salt-and-pepper-panda, myhappyhotel, galactiel, colored-teddy-bear, illicitnapper, krikkit, discourse-by-a-smoll-queer, paral-l, trulymadlyrosie, emmettisawesome, eggstraw, coffin-bird, vulpeccula, wlwlovingloki, ch4m3l3on-tr3nd3r, 123booyakasha, sickbitterandcoveredinglitter, littledeludeddupes, trashkin, cmdrslagathor, lthurley, thebridgetonarnia, goldenites, artisticgamzee, martinaagp, spacehunter-m, lady-tabris, sarkos, indiegenous, armenian-dolphin, demon-duck-named-darcey, kelptalks, prodigiouspippa, pippip-cheerio, asterius0293, strikecommandergabriel, mateodoodle, thepowerpupgirls, chandelegion13, kawaiigal132, biswedishgirl, ameliafromafairytale, syd-simone, silver-tigress, bugboytoes, bisexualr2d2, well-fix-it-in-post, faraday-cage, dancinglikeahippogriff, al-likestodoodle, leify, icestarstorm, ghosttrinket, anxiousdemifaemess, the44th, bruucebanner, cadenboy456, lordchao, miauhause, alliharkness, w3th3drown3d, gimopi, rianafying, moonflowero1, ginger-the-espeon, heythereitscat, zang269, violettherainwing, felinedetached, monde-de-gris, babybutchcowboy, brokentoothmarch, digitalcactii, chaotic-illusion, doctor-of-nothing, hellchilde, thetathepurpleplatypus, justice-or-revenge, eclectic-nb, el-lemon-sharmouta, youareunbearable, betchpls, unamazing-grace, tofu-pofu, eliottredd, rainfillet, triple-emotion, overtherainbow-underthesea, kitteneyejo, dasbender, crankthatyee, ahmenophus, eenomoto, a-very-confused-human, disneyprincessinlokisarmy, lee-fletcher, justonegeek, raccoonskulls, deverickracoma, lgbtpositives, fanbott, socks-bog-wench, guesswhoiamplease, tigerstripedmoon, meromeow, murtogg, calisotalatina, majestic-training-wheels, lesbian-sapphire, strawberrymilk114, stupidly-curious-at-best, aro-ace-from-outer-space22, manicpixiepeengirl, sly-is-my-name-loving-is-my-game, moppet-13, just-a-cinnamon-bun, skittlesthekitkat, blayzez, panic-atthe-romance, parttimetrickster, aquietanarchy, welcomeallgays, sincitysgreatesthits, parabailarlabanba, extrinsicalmadness, lukarian, apptowonder, honorarybigsister, neighdeathneverstopyou, tremblingwithqueer, princessknightt, elkrat, dfkshkjs, honestplant, supersoftie, gay-halforc, chaoticmessofworlds, gay2kornee, goldwingthescholar, gayagendaofficial, hellforcertain, curiekatz, oskar-is-nervous, mekasmechanic, oh-fuck-its-sans--undertale, kyrakiwi, spacemoonsam, creeshtar, doggcity, nataliaroman0va, castostrophic-phantasm, sofonimichel, goat-daughter, relativelyquietamerican, sad-but-lovely, autisticdemigirl2002, avatarreigisa, lemonsbian, kieranreblogsthings, lettuceforchristmas, the-uhh-dragon, protect-yangs-smile, slow-dance-in-the-dark, madswantstofight, moonkissess-moving, shadows-of-a-life-before, flurry-of-beaus, iseesmoonlight, librariandragon, ravenbranwyn, markymarklosthisfunkybunch, mayzedong, wrenvibes, lasilhouetteinbianco, candy-snap, snapback-gravity-falls, yukineko-kitty-chan, maziedecrazie, cobbled, kkeithss, sunnyevan, palmetto-ravens, makaramiracles, ferrasspace, honeybaublebee, ferociousfangirlofmanyfandoms, the-fairy-dong-mother, nondysphoric-enby, noxpotion, symphothy, oodlenoodle, juuzoutransbian, hunchpop, thumbspooning, thegreatspain, like-everyone-else-i-dont-care, bisexualjeon, sarcasticjest, tutmodic, cryptidracccoon, forest-khalse, nerdy-lesbian-musician-bihh, doom68, space-captain-fonix, hulk-janitor, boatsandmermaids, muddpunk, cloudrot, anti-transmed, antisocial-author, deadlymochi, togaocha, guyofhawk, raydrachen, randommagikarp, meshkwahkihaki","katsumiri, kelptalks, unfortunateseriesof, shevi-hime, unfortunateseriesof, lesbian-sapphire, tiffycatblogs, meshkwahkihaki, working-class-wizard, lalondeproblems, unfortunateseriesof, actualvaxildan, unfortunateseriesof, unfortunateseriesof, oniongrass, razorkillrabbits, strikecommandergabriel, gay-decepticon, murtogg, gay-decepticon, spacehunter-m, nicknaklmao, lgbt-for-poc, tiredandangry, emmettisawesome, artisticgamzee, cutmefromthelight, sickbitterandcoveredinglitter, felinedetached, k1lljoyqueer, pippip-cheerio, notalwaysweak, choco-myth, sjw-dipper, erroneousmonk, bruucebanner, nicknaklmao, notalwaysweak, artsysquiddles, added:, productofanolympianorgy, sickbitterandcoveredinglitter, meshkwahkihaki, armenian-dolphin, artsysquiddles, spacehunter-m, mortuarybees, officialclarith, lady-tabris, spacehunter-m, oriionsbelt, emblian, emmettisawesome, pippip-cheerio, wormlad, vulpeccula, working-class-wizard, indiegenous, spacehunter-m, myhappyhotel, happilyetherafter, happilyetherafter, sarkos, salt-and-pepper-panda, salt-and-pepper-panda, bitronic, spacehunter-m, meshkwahkihaki, littledeludeddupes, penicillium-pusher, diamoric-positivity, pippip-cheerio, consintently, coffin-bird, sickbitterandcoveredinglitter, sickbitterandcoveredinglitter, pippip-cheerio, walkingtransdisaster, littledeludeddupes, strikecommandergabriel, meshkwahkihaki, trashkin, trenderpunkdollz, lady-tabris, artisticgamzee, spacehunter-m, indiegenous, goldenites, artisticgamzee, chambergambit, spacehunter-m, lady-tabris, creeshtar, sarkos, dancinglikeahippogriff, transpopuko, mothsuit, homophobic, pippip-cheerio, strikecommandergabriel, strikecommandergabriel, lee-fletcher, added:, fruitsgoblin, finding-my-culture, bisexualr2d2, heythereitscat, cupidcore, toodonetopun, neighdeathneverstopyou, heythatsprettyneit, bisexualr2d2, manthedog, mishmuf, bruucebanner, hellchilde, murtogg, murtogg, canis-la-trans, finding-my-culture, neighdeathneverstopyou, felinedetached, alliharkness, hellchilde, ridiculous-lazybug, gimopi, gimopi, violettherainwing, ginger-the-espeon, rainfillet, sunbeans, violettherainwing, lettuceforchristmas, youareunbearable, felinedetached, snapback-gravity-falls, finding-my-culture, blayzez, monsterbutch, oodlenoodle, makaramiracles, meromeow, tofu-pofu, sweet-sapphics, youareunbearable, curiekatz, musing-stars, stonebutchcowboy, letrickster, tofu-pofu, tremblingwithqueer, tifs-against-terfs, nerdy-lesbian-musician-bihh, seasofgalaxies, kitteneyejo, cocksuckerjoe, pawsforall, meromeow, added:, roboticonography, trenderish, aro-ace-from-outer-space22, noxpotion, added:, tigerstripedmoon, neighdeathneverstopyou, sly-is-my-name-loving-is-my-game, offbrandcocacola, meshkwahkihaki, aro-ace-from-outer-space22, randomslasher, snapback-gravity-falls, sjw-dipper, neighdeathneverstopyou, snapback-gravity-falls, blayzez, snapback-gravity-falls, sly-is-my-name-loving-is-my-game, aro-ace-from-outer-space22, sly-is-my-name-loving-is-my-game, aquietanarchy, skittlesthekitkat, aquietanarchy, sad-but-lovely, lupsbutchgf, creeshtar, parttimetrickster, gay-halforc, apptowonder, meshkwahkihaki, not-sapphic-lite, tremblingwithqueer, protect-yangs-smile, doggcity, honorarybigsister, hellforcertain, hellforcertain, dfkshkjs, ravenbranwyn, gay-halforc, not-sapphic-lite, ravingsofabitch, snapback-gravity-falls, curiekatz, gay2kornee, gayagendaofficial, snapback-gravity-falls, oodlenoodle, shoutyourporpoise, samaranththefleshweaver, noxpotion, protect-yangs-smile, lettuceforchristmas, nataliaroman0va, iseesmoonlight, snapback-gravity-falls, doggcity, penicillium-pusher, protect-yangs-smile, stonebutchcowboy, oodlenoodle, protect-yangs-smile, chapstickmcdyke, lettuceforchristmas, snapback-gravity-falls, ravenbranwyn, snapback-gravity-falls, protect-yangs-smile, flurry-of-beaus, flurry-of-beaus, ravenbranwyn, markymarklosthisfunkybunch, shirogane, ravenbranwyn, ravenbranwyn, nbtranslink, sharpestscalpel, mayzedong, snapback-gravity-falls, shirogane, snapback-gravity-falls, snapback-gravity-falls, makaramiracles, ferociousfangirlofmanyfandoms, lightningclaw13, missy-mistress, queeryeshivish, cupidcore, trenderish, thumbspooning, the-fairy-dong-mother, nondysphoric-enby, the-fairy-dong-mother, the-fairy-dong-mother, vampirichabit-z, trenderish, space-captain-fonix, oodlenoodle, muddpunk, cloudrot, anti-transmed, space-captain-fonix, alkahestrying, forest-khalse, thetallestjew, forest-khalse, cloudrot, trenderish, space-captain-fonix, troodon17, sirtamsalot, cupidcore, raydrachen, clowngayy, cloudrot, shirogane, honey-mlmxx, k1lljoyqueer, cupidcore, k1lljoyqueer, agenderneutralchibithing, missy-mistress, honey-mlmxx, this",queer-no-matter-what
0,186440846508,starkdottir,,,"80,832 notes, 80,832 notes, , ","https://queer-no-matter-what.tumblr.com/post/186440846508/embed, https://queer-no-matter-what.tumblr.com/post/186440846508","80,832 notes","kk-chama, orchid-tea-party, pencilspowers, dalekslayer, everythingidid-ididforthem, fromthegallifrey, starryeyedbibliophile, highoffsharpie-fumes, fluffy-undertale, madisonnkelleyy, brooke--groves, bearsinpotatosacks, kitkatcalle, wishitwasus, the-emo-nightmare-is-here, jakwgyllenhaal, beweeee, avengersincamphalfbloodstardis, thatsamood25, marshmallow--boy, r0kket, thaliamoonnight2, nolongerfinelyfinley, theblehthatbloos, captiqngeans, shadesofmelancholy, woosaaghh, sternenblumen, harrysittybittytitties, shereluck, prinxebleach, mcmarns, boringseanahan, lemon-meringue-dyke, sterlingsilverscifo, laughterinthestars, starboy-suh, wonderifumissmetoo, timafa, concerto-in-f-me-major, galacticdiddles, constantmalarkey, awesomebrooklynnbridge, salty-backup-catcher, whatswrongtav, brenanasday99, connor-mcbaevid, irishkid21, nikilaudas, lattschristmas","pseudo-seraphim, songsofsprites, pug--prince, l0rd-of-the-oreos-vol2, thericefairy, llittlebratt, l0nelynight, black-on-constellations-gold, princesssteve, mary14980, pogaytos, hachihime, bellarkemeetsagain, everything-is-applepie, lightinthedarkuniverse, fundaymentally, blackfyr, greenegsandham, trm246, still-sighing, woosaaghh, shereluck, my-dude-tyler, minty-mentos, jennacide-and-revolution, fregglover, i-am-going-to-my-mind-palace, bijackkelly, lemoncake206, gayer-than-your-average-dyke, shortandpink, sendmememeskatie, robbieisabel, crystep34, galacticdiddles, mcchickenextramayo, huntress98, icouldbefamousoneday, dysfunction-and-stardust, karmacharmeleon18, ill-just-be-here-with-my-books, lyssa-drak, samsbennett, kingdomofwhistfulart, whatswrongtav, jadesyxjauregui, meganejs, connor-mcbaevid, lattschristmas, starkdottir","starkdottir, starkdottir, llittlebratt, starkdottir, viir-tanadhal, l0nelynight, starkdottir, spaceboyfrnk, americankimchi, starkdottir, posiemania, bellarkemeetsagain, beauyega, huntress98, gingerwerk, velosarahptor, kingdomofwhistfulart, samsbennett, sunspill, pucksbeforefucks, galacticdiddles, i-am-going-to-my-mind-palace, gayer-than-your-average-dyke, i-am-going-to-my-mind-palace, fregglover, dysfunction-and-stardust, bijackkelly, gayer-than-your-average-dyke, gayer-than-your-average-dyke, karmacharmeleon18, connor-mcbaevid, icouldbefamousoneday, itsthelastquestion, itsthelastquestion, meganejs, pucksbeforefucks, starkdottir, dysfunction-and-stardust, meganejs, ill-just-be-here-with-my-books, connor-mcbaevid, samsbennett, poehlingryan, connor-mcbaevid, connor-mcbaevid, poehlingryan, captain-toewss, captain-toewss, pucksbeforefucks, this",queer-no-matter-what
