,post_id,source,text,tags,post_date,url,n_notes,likes,rebloggers,rebloged_from,user
0,183725742223,heartfull,"if ur trans and do things associated with your agab you’re not a “trender” ur just having a good time keep it up.
truscum are bitches",,"1,104 notes, 1,104 notes, , ","https://queer-no-matter-what.tumblr.com/post/183725742223/if-ur-trans-and-do-things-associated-with-your/embed, https://queer-no-matter-what.tumblr.com/post/183725742223/if-ur-trans-and-do-things-associated-with-your","1,104 notes","reesecomplains, spicylymax, czernyxs, furbygiovanna, snacksatmidnight13, holdjnqq, 2shleepyy, fearthewalkingnation, genderlesspuddleoftears, coffinpuppy, trans-love-is-power, puppyluvcore, earthmoonlotus, earthquakeofideas, catsarecutebutaliens, thellamaisinthehouse, j-uwu-ish, rosemary-monarch, thebrightgreenscream, ask-moss-summers, knifeloki, quixotix, picknick-am-abgrund, stridah, just-cloudy, hpafterlife, percy-james, droamiin, graupig, ilovemy2pandas, frost-deamons, a-huge-romantic, bagel-san, dichterfuerstin, mikanpie24, plastic-ghosts, i-found-my-jason-todd, unscharf-an-den-raendern, magicalrulerkittycat, weef22, mylgbtitaliait, laybrushlarcenist, squaamataa, lcmontea, feralpapyrus, bpdnepeta, burnsbrght, hee-blee-art, transphobick, alby-lee-sok, aqoursidol, queerdelphoxboy, nyredspins, aaronsaintjames, turquoisekim, aeide-thea, cosmopinkprincess, raynaud, halfasleepmostlydead, the-poetic-mathematician","nick-carraways-side-hoe, livinglegacy, mortalkombatdeception, coffinpuppy, bunnypoltergeist, puppyluvcore, catsarecutebutaliens, breadandanxiety, southie-dakotie, toshi-moshi, edgaristhefox, stridah, biophilie, trans-witch-jayce, bizzarespacetrash, someplanetelse, peachflavouredicetea, glassstrings, shewolf-2013, unscharf-an-den-raendern, weef22, queer-no-matter-what, featherydick-muffins, cr0wblood, thinking-is-dangerous-i-know, ophie-opossum, pissed-off-internet-dad, alby-lee-sok, dollierotz, thanosjones, queerdelphoxboy, nyredspins, turquoisekim, spirit-of-science, cosmopinkprincess, umblrgumblr, glassstrings","glassstrings, mortalkombatdeception, puppyluvcore, puppyluvcore, puppyluvcore, glassstrings, marylightly, toshi-moshi, toshi-moshi, edgaristhefox, someplanetelse, biophilie, german-naruto-opening, bizzarespacetrash, glassstrings, unscharf-an-den-raendern, unscharf-an-den-raendern, this, queer-no-matter-what, queer-no-matter-what, queer-no-matter-what, glassstrings, added:, glassstrings, ophie-opossum, spirit-of-science, added:, glassstrings, nyredspins, added:, glassstrings, glassstrings, umblrgumblr, umblrgumblr, umblrgumblr, sorryaboutyourmom, this",queer-no-matter-what
0,183725727923,chaoticbastardenergy,"bitchsexual (adjective): when youre bi but also just, like, a real fuckin cunt, yknow?",,"6,158 notes, 6,158 notes, , ","https://queer-no-matter-what.tumblr.com/post/183725727923/bitchsexual-adjective-when-youre-bi-but-also/embed, https://queer-no-matter-what.tumblr.com/post/183725727923/bitchsexual-adjective-when-youre-bi-but-also","6,158 notes","carbohydraytion, thatonegaykai, dizbleh, consumption-junction, phantomfrequency, durpygamerlox, dogboi39, pleasantpizzapastagiant, mint0ath, daytiimes, arlethallan, angry-queer-noises, hello-my-name-is-bisexual, seulgiii-jpg, thesickbird, alexisoov, bigcherrypopsackle, happysuitcasegoop, tadpal, kaahmartzz, mickdickies, alrightieaphrodite, fookin-trashz, aeropeach, m0l1y-011y-01ly, babeyhearts, mothian, tired-philosopher, lilypadforman14, ravenclaw-is-the-best, valiantteenageluminary, lavender-zone, delegorguei, heneralmoon, tberg99, knownpeacekeeper, theghostbi, stupidusernamepolicy, introvertsmoothie, mimmousss, mogai-baby, marrow-bone, a-neoncity-insomniac, zacksdysphoricplace, perlerannie, the-stabbo-crabbo, volcanicphoenix, whatthefrickfracktictacisgoinon, coffledragon, all-darkstars, starrysparklesandshit, skirefly, hemmotionalharrington, nocomm-ent, thrssii-deac, prescription-rum, ashlynx-is-trans, regnetstudy, give-me-cats-or-give-me-death, coronami, north-winds-dragon, justssmol, lovefuii, animeboyjuice, goodmorningzen, sugarthe, resurrected-demonic-kai, worst-player-ever, official-brennivin, antoniolovestea, pokeeevee100, darlingfreddie, catpirzen, pinkyshy6969, windexbindex, strawberryorganns, fboe-nemo, mabsgatos, the-ghxst-of-youu, spill-the-vodka-infused-tea, coupondarling, time-to-dip, clownmikey, bytememes, dennisalagic-blog, christhebish, sweetopinion, gaycatpark, possumbitcx, political-anonymous, aphobiq, amative-amanda, starrsspace, boring-berry, isaac464, notsoenglishgamer, nether-song, maxemerson666, saltonpopcorn, pastel-glitchh, razzmatazic, mrmcperson, the-local-cryptid, thecolorwhite-against-onision, saviourofawakingworld, afantabottle, binkybabii, just-a-smalltown-guy, aero-sea, keclee, antikink, orangebendyboi123, paradoxicull, gingersexualcunt, ember-core, yaboi-nat, notta-nope, swallowedafallenstar, bovrilcat, pikachu-jesus, kaecutiee, everyothermouse, sharkotic, argusfaineant, that1lesbianthespian, recycleddyouthh, gay-for-gee-way","consumption-junction, somethinginourblood, mint0ath, rosegoldarti, squidlywiddly87, bigcherrypopsackle, blueskysmackdown, nadia-my-love, alarming-opossum, delegorguei, heneralmoon, knownpeacekeeper, stupidusernamepolicy, a-neoncity-insomniac, existentialcrisisetcetera, twendr, sparkly-thot, coffledragon, southern-snow-angel, why-im-still-awake, fox-sanguinis, nocomm-ent, rubyslippersemeraldcity, wannabe-davis, prescription-rum, ashlynx-is-trans, give-me-cats-or-give-me-death, north-winds-dragon, memelindaa, lovefuii, tyler-joins-the-party, lemony-speckle, spilled-bad-wine, dysphoric-rohan, antemalgamate, totallyalegitspy, whoremano, official-transgender, cookiesandpudding, aeckelpotta, doctor-7up, bobasaurindahouse, jasperthechoaticghost, bytememes, christhebish, sweetopinion, whattheheckisasallad, pxterbpxrker, political-anonymous, amative-amanda, aloofali, boring-berry, bi-catastrophe, benswolo523, nether-song, pastel-glitchh, roguegxrl, soumissionformen, the-local-cryptid, railrd, somber-soprano, keclee, this-name-is-sorta-long, antikink, fingertattoos, sharkotic, paradoxicull, yaboi-nat, roublardise, bovrilcat, that1lesbianthespian, bioabsurdist","bioabsurdist, bioabsurdist, bioabsurdist, squidlywiddly87, bioabsurdist, nadia-my-love, mascbi, bioabsurdist, bioabsurdist, bioabsurdist, knownpeacekeeper, stupidusernamepolicy, dysphoric-rohan, todays-rich-goranski, fox-sanguinis, sparkly-thot, official-transgender, rubyslippersemeraldcity, give-me-cats-or-give-me-death, nocomm-ent, nocomm-ent, tyler-joins-the-party, give-me-cats-or-give-me-death, give-me-cats-or-give-me-death, give-me-cats-or-give-me-death, spilled-bad-wine, tyler-joins-the-party, official-transgender, bioabsurdist, tyler-joins-the-party, spilled-bad-wine, spilled-bad-wine, dysphoric-rohan, official-transgender, official-transgender, whoremano, official-transgender, political-anonymous, bioabsurdist, bioabsurdist, bioabsurdist, bioabsurdist, bioabsurdist, bioabsurdist, decently-literate-cryptid, todays-chloe-valentine, bioabsurdist, added:, bioabsurdist, aloofali, bioabsurdist, bioabsurdist, bioabsurdist, the-local-cryptid, the-local-cryptid, bioabsurdist, the-local-cryptid, the-local-cryptid, bioabsurdist, bioabsurdist, bioabsurdist, bioabsurdist, bioabsurdist, fingertattoos, kurtwagnermorelikekurtwagnerd, bioabsurdist, bovrilcat, bioabsurdist, cisphobicagenda, bioabsurdist, todays-jeremy-heere, this",queer-no-matter-what
0,183706584678,"modagbul, fuck-cistrenders, tired-truescum","An analogy for why you need dysphoria to be trans
For this analogy, we’re going to use depression. Depression is a mental illness which can be treated with antidepressents. For a depressed person, antidepressents can be extremely helpful. There may be a few negative side effects, but the benefit is worth the cost. The meds help this person.
Now, let’s say someone who isn’t depressed desides to take antidepressents. They start taking the antidepressents and, because they weren’t depressed, they don’t help them. There are no positive effects for this person, only negative ones. The meds hurt the person instead of helping them because they never needed them in the first place.
For gender dysphoria, it’s the SAME THING.

We now have a person who has gender dysphoria. Gender dysphoria is a mental illness that can be treated with physical transition, such as HRT and/or sex reassignment surgery. The dysphoric person goes on HRT and find themself much happier and much less dysphoric. The effects of the HRT help them.
On the other hand, we have someone who doesn’t have gender dysphoria. This person, for one reason or another, decides to undergo HRT. However, because they were never dysphoric, the HRT doesn’t help them. The effects of the HRT, for this person, are all unwanted and often actually make the person dysphoric. The effects of HRT don’t help them because they never needed it in the first place.
Don’t undergo medical transition if you aren’t dysphoric. You will NOT like the effects., hey dumbass
im not diagnosed with depression and my doctor doesn’t even suspect i have depression
but i was prescribed antidepressants
and they’ve had a positive effect on my mental health
your analogy fuckin SUCKS, Why would a doctor EVER prescribe something that isn’t medically necessary? The answer: they wouldn’t. Medication can drastically change the way your body functions. Antidepressants, for example, reduce the volume of your hippocampus and your anterior cingulate cortex. They literally CHANGE YOUR BRAIN STRUCTURE. A doctor would never prescribe antidepressants unless necessary because the changes can be very unwanted and possibly lifelong. It’s the same way with dysphoria. There’s a reason you won’t be prescribed hormones unless you’re dysphoric.
So, you’re probably lying. If not, I’d switch doctors., they are medically necessary. the point is you can go on antidepressants without depression because they treat anxiety disorders too, therefore your analogy is bullshit. weird how you’ve researched the precise ways antidepressants affect the brain structure and never once heard that antidepressants aren’t just for depression., Hey, @tired-truescum? My doctor put me on Sertraline to treat my GAD, even though it’s considered an anti-depressant. Most anti depressants, in fact, are used for treating other problems such as neuropathic pain, IBS, sleeping problems, and even migraines. I think medical professionals know what’s best for their patients than some Tumblr user. Please inform yourself on subjects you don’t understand before spouting bullshit, thank you. , The point I’m trying to make is that you shouldn’t take antidepressants unless it’ll medically benefit you in some way. I said depression because, well, that’s usually what antidepressants are used for. If you have no medical condition that can be treated by antidepressants, you shouldn’t take antidepressants because it’ll negatively affect you.
Similarly, if you have no medical condition that can be treated by HRT, you shouldn’t go on HRT because it’ll affect you negatively (reverse dysphoria, unwanted lifelong changes, etc). The only medical condition I can think of that is treated by HRT is gender dysphoria (or perhaps growth problems, but that’s not what tucutes or myself are focused on).",,"446 notes, 446 notes, , ","https://queer-no-matter-what.tumblr.com/post/183706584678/an-analogy-for-why-you-need-dysphoria-to-be-trans/embed, https://queer-no-matter-what.tumblr.com/post/183706584678/an-analogy-for-why-you-need-dysphoria-to-be-trans",446 notes,"bourgeoisieee, biscuit-and-jam, king-satan-nipple, sweetsapphicsunflower, waerrann, brklyn-isnt-my-real-name, ftm-indeed, arschketchup, frickled-via-cactus, bigolmoodstrikesagain, a-slytherin-queer, sakurastallion, hereandqueernowwhereisthebeer, not-your-average-transboi, pomegra-nate, thorkylo, anti-transtrender, hornygayspam, fall-out-dan, sam-the-human, tryh4rddd, miraclewax, charlunday, themadhowler, penis-sucker69, orangebendyboi123, totally-not-a-tranny, shannonm456, paramourner, wiz-witch, heavvygloom, uwu-doughboy, graveyardlegend","despicabledeadpool, tucutes-do-more-harm-than-good, bsttrash, brklyn-isnt-my-real-name, frickled-via-cactus, still-learning-still-changing, heckin-anxious, benditlikegumby, lil-radon, anti-transtrender, jasonmydreams, penis-sucker69, king-satan-nipple, tired-truescum","added:, added:, tired-truescum, anti-transtrender, tired-truescum, tired-truescum, anti-transtrender, anti-transtrender, anti-transtrender, tired-truescum, tired-truescum, tired-truescum, tired-truescum, this",queer-no-matter-what
0,183529766643,,,"positivity, love, posi, wlw, lesbian, sapphic, lgbt pride, lgbtqi, lgbtqiap, lgbtq, lgbt, lgbtqa, glitter, makeup, hearts, heart, eyeshadow, prasin the asian","12 notes, 12 notes, , ","https://queer-no-matter-what.tumblr.com/post/183529766643/the-heart-glitters-really-didnt-translate-well/embed, https://queer-no-matter-what.tumblr.com/post/183529766643/the-heart-glitters-really-didnt-translate-well",12 notes,"nonbinary-and-sick-of-your-shit, fangirling1-0-1, that-annoying-bitch, glo-bzz, elsarocks09-blog, joshyrocks5-blog, thenonbinary-starprince, herr-toyota, darinmyheart",queer-no-matter-what,this,queer-no-matter-what
0,183529298138,truscum-love,"HEY TUCUTES
i don’t care if you have different beliefs and feelings for a topic than me.

📬 i hope you don’t get death threats or hate messages 📬
💕 i hope that you’re happy 💕
✨i hope you have some good food today ✨
🗑i hope you don’t feel like trash today🗑
❤️i hope you are happy with yourself❤️

i’m bad at making positivity posts sorry. anywho, even if someone doesnt share you same beliefs please don’t send them hate or death threats or suicide bait. don’t wish bad upon them. they’re people too.",,"940 notes, 940 notes, , ","https://queer-no-matter-what.tumblr.com/post/183529298138/hey-tucutes/embed, https://queer-no-matter-what.tumblr.com/post/183529298138/hey-tucutes",could not find notes,,,,queer-no-matter-what
0,183528985808,truscum-love,"what being truscum is:
believing you need dysphoria to be trans, against mogai (not gnc or trans people)

what being truscum isn’t:
being transphobic, a terf ally, or helping transphobia/homophobes",,"600 notes, 600 notes, , ","https://queer-no-matter-what.tumblr.com/post/183528985808/what-being-truscum-is-believing-you-need/embed, https://queer-no-matter-what.tumblr.com/post/183528985808/what-being-truscum-is-believing-you-need",600 notes,"speyeral-feesh-caek, lunaqueenofthevoid, goatguy7399, architechhs, trans-bundle-bun, breakingbrickswithmydick, scottjate, gay-demon-prince, reidthestoppable, yuroui, the-robot-universe, scaredy-ant, e-luck, bitterestlemonboy, gayrabbi, corvidcries, obxiiv, knife-eared-warden, s4ns1cal, thatgaygoth24, reesecomplains13, dagprivate, uwurza, moonselkies, spookykiwibird, hexaquarion, ale8i, raqhaelia, babyg0ttafever, dakota-is-very-tired, the-secret-is-crime, closeted-ftm-responses, 51naminro, foxoul, killukii, exclusivedave, skittlezroses, another-gay-bard, bitransguy567, an-impartial-nihilist, alivelemon, jokercourse, amorphousshoe, nichememesfortheclassics, xboxopossum, toothy-merpagan, xerodiu, neonwillowtree, inu-demon, matchboxdoe, chlopossum, whoopstess, lordrubberduckyy, sparkles-and-tap-shoes, female-david-tennant, girly-artic-foxx, oreotord, green-is-cosmic, mustard-witch, gabrielhafoundl0ve, thatwitchybitchandco, folkyboi, rosstheweirdo, karmasdoll, doodlepede, blurrymango, nasti-imagines, askthetoblerone, transmascandcheese, suspicious-lilies, goblin-clown, discount-cornflakes, eye-vale, maethefox, teal-trans, jabadoodlez, reesecomplains, n0ndescr1ptsho4, solsticesnowdrop, prettysebastian, leafy-lesbian, milky-0-milk, dysphoria-day, old-blog-not-in-use, wowtherekidsthatsoundsedgy, coinless-ranger-slayer, sunnn-yboy, ellerythelesbian, thenperishdotexe, crowfeatherss, ardenbot, break-a-snake, women-are-swell, saexawa, trenderpigeon, thebutcheringart, smoo-draws, transm3d, sleepykatdraws, serenadesonata, eggxcellent-discourse, yumikoneko, yeehaw-trans, the-opinionated-moose, sparklyshineshimmer, lyndsirose, evergreenthoughts, eilikes, andromeda-galaxys-blog, erst-der-letzt, thetoxicneko, bust-a-spook, hello-charade, poprockz12, rottendayo, perlerannie, colonel-robert-lee, micahs-world, epahst, that-one-moon-kid, scoutdoesnothing, crysptrsh, tu-comptes-tant-pour-moi, inhuman-adventures, jollycinccino, nohomomydudetwt, supremeleadersock, rottenapples-please, pepsicoughdrops, phils-cereal-fetish, ukulelelex, nyanaroo, waste-face, paranermalactivity, trans-chat-circle, dystopiaforbreakfast, bethanyimade-biscuits, therarestfudanshimyurlisajokebtw, punk-rats, hikiyokai, planetary-00, someone-get-me-out-of-this-hell, sampl-boi, uiopthebrave, pineapplemandan, thetmisosarchives, queer-no-matter-what, 6queer6queen6, nonbinary-coded, happysarcasm, caffeineriggedsloth, fryingpansss, inspector-loki, theroguetoast, dreamyssoda, why-not-post-fiction, cherryseamist, daddysdevito, maxn1o, p3ach33, www-jesushatesme-com, neurodiversehogwarts, zacksolddysphoricfamily, sapphicparker, timeworndemistar, chrispoke, stormgrayskies, definitelynotaconch, m15t3rpr351d3nt, superduperwinchester, euphoristboy, murrays-username, thatrandomguy-akatheinternet, mimillion, homefuck, transphobick, ashasass, thanosjones, your-little-transmedical-sis, milkgabor, devillishdaydream, toenail-soup, rcming18, kronyas, galaxycat-1459, not-a-happy-killjoy, reblog-house, assasinglasses, thatsalintel, literallysephiroth, halcyonjester, sparkleleech, bryceismynewname, kuitten, edgelord-against-onision, lucietian, ck-starboy, ashy-rxses, wolfsongroar, tysatan-moved, exclusive-cowboy, yoshipiawesome, thatdudemaison15, nightynitehours, toastingtotheghosts, snip-snircuits, nonyxa, kakuriyo-translations, laydeadad, goodmorningzen, marbles-shall-be-lost, bunnyhoodsellout, drabonthekibby, sparkxii, thelarpdude, chris-evans-hemsworth-pratt, nyell-0, i-am-not-a-deatheater, waitaminuteichangedmymind, scawwytwuscum, thetruscumsiren, your-friendlyneighborhooddumbass, keyboard-lion, natarisaru, haddonfield-hell, tsgge, wynter-skye, northerngreen, sakurastallion, dobby-is-never-free, researcher-talloran, neocolorroseishere, arobi-channie, hobisserendipity, shanesexual-boi, ender-transman, tired-of-tucutes, ilove-thesimpsons, mossrats, tyler-geraldine, lazyfanphilosopher, theskeleton-key, deadvoicesclub, transmed-troodon, dog-brainz, pisspasta, dear-me-emp-tea, fancyschmancyfandomshit, venusvsvanilla, yumimirai98, rowenduchannesj, kephissoss, lightupheelies, zireaaal, eternalkastaway, fleetwood-mackerel, brindlefern, back-to-the-toaster, hydrati0n-nation, myles666, gh0sty-y, gyungmi-overwatch, wewillywinky, sunrainbowsun, not-a-fucking-muggle, rakueen, breiffontcollector, ultramysticprincecollection, dancylildeacy, all-daybreakfast, dumbkpopfanboi, noahdesh, javaisnom156, im-jack-dudes, friendly-neighborhood-bastard, arcsin27, rebel2anything, uwu-doughboy, timelesstheory, sresmed, mylongjourney, scotchiescotty, annie-himym, satantheartist, the-rose-of-versailles, gilbertandfilbert, wereana, largic, miss-radical, 0kira-tenshi0, that-confused-lab-experiment, introverts-assemble, antiseptic-handwash, abnormalcosplaysandart, battly-watt-13, pavlovshair, mellowcollectionnutmakespai, static-screenager, moments-of-sonder, pixel-poof, archiehateshimself, funloving1579, itz-sonny-d, bitchboyyyyy, strawberry-anomaly, aryagreenapple, steampunksnake, ravings1, thekidnapvan, huehaetias, lifeofcynch, beethoven-did-cocaine, cinnamon-armin, emo-and-dumb, horrible-life-choices, meiancholythoughts, graysonphoenix, ouma-course, trans-pureblood, pill0wquirk, airstos, mishakostinyouknow, nicotinelives, anurix, odetocaution, this-red-medic-bites, alpha-fork, mabari-nation, aarontruscum, polmccardney, sad-smoothie-boy, dylanoutthesecards, 0alexis-texas0, sapphiredragon10, orangebendyboi123, dense-ass-dumbass, sidewaysspun, hotpocket-fucker, spindriiffftttttt, bsmrch, roman-harley, orion-the-ryebread-man, sn0wtaffy, jakethedirteater, leonardowatch, william-david-afton, alecthekinq, 0723sasuke, theowoeht, some-crappy-thing001, spisaar, redkitty50, trannsmed, tired-hopelessromantic, jvplter, fabio-the-camel-god, m-o-v-e-d-xo, freezing-blue, ko-shichi, snickerslizard, justafilthydog, confusedbitch65, pigeon-05, tuzzy-wuzzy-uwu, levicoolio, kielljoy, purpleoctop1e, fugue-of-wandering-stars, icyraindrop, lgbt-pride-and-more, voncent-am, paradoxicalshawol, eulyptical-machine, wepoli-an, sagethotxicroak, featherydick-muffins, inkyashiya, sguardofissonellabisso, yuk--ki","trippingzira, paranoidboyd, still-learning-still-changing, gay-demon-prince, trucescum, transmedmiku, bitterestlemonboy, gayrabbi, thesingeseries, hexaquarion, agendertransmed, foxoul, exclusivedave, truscum-love, agendertransmed, tranny-yoshi, kingfawx, a-possum-drinking-pepsi, toothy-merpagan, xerodiu, neonwillowtree, inu-demon, matchboxdoe, snoot-boop, girly-artic-foxx, bageltastic69, folkyboi, karmasdoll, truscum-love, blurrymango, jabadoodlez-spam, momma-snep, finalhazardd, fucking-stellar-tbh, pyroprincee, astrological-tranny, spencer-the-gay, truscum-love, truscum-vivi, yeehaw-trans, pill0wquirk, yumikoneko, the-opinionated-moose, evergreendiscourse, eilikes, saerans-rose, toni-hargreeves-official, soft-ish-girl, largic, transmedmiku, a-possum-drinking-pepsi, tu-comptes-tant-pour-moi, truscum-love, myles-k-cervidae, sampl-boi, trans-pizza-eater, queer-no-matter-what, nonbinary-coded, caffeineriggedsloth, iridianmash, dreamyssoda, alex-the-tranny-is-online, www-jesushatesme-com, truscum-love, tyftvv, villianmutual, thatrandomguy-akatheinternet, transphobick, ashasass, moody-trans-boy, thanosjones, kronyas, nutritiouss, dickless--wonder, inventivetapir, bizarrolord, edgelord-against-onision, lucietian, truscum-love, tysatan-moved, tired-of-tucutes, thatdudemaison15, gay-demon-prince, shagsjxjcksns, sapphic-grell, captjackdiscourse, truscum-kaminari, chris-evans-hemsworth-pratt, wavestep-ddream, anddshewas, thetruscumsiren, wynter-skye, truscum-love, sakurastallion, neocolorroseishere, transmed-troodon, pisspasta, rowenduchannesj, princeaqu, fleetwood-mackerel, hydrati0n-nation, asphodel-night-adder, truscum-love, transmed-goblin, dazeddiscourse, inventivetapir, the-rose-of-politics, transmedicalist-oshawott, exclusive-cowboy, spill-the-gender-tea, whippedcreamtransmed, closetedguyy, truscum-love, mightymorphing-human, icey-bastard, shagsjxjcksns, lifeofcynch, theelmstreetremakewasntthatbad, mr-spilled-tea, aarontruscum, blueisnotokay, 0alexis-texas0, sidewaysspun, orion-the-ryebread-man, alecthekinq, truscum-love, some-crappy-thing001, trannsmed, m-o-v-e-d-xo, confusedbitch65, fucking-stellar-tbh, wepoli-an, sagethotxicroak, transmedicalism-saves-lives, truscum-love","trannsmed, truscum-love, truscum-love, transmedmiku, transmedmiku, trannsmed, gayrabbi, truscum-love, trannsmed, truscum-love, agendertransmed, truscum-love, trannsmed, this, evergreendiscourse, truscum-love, truscum-vivi, truscum-love, inu-demon, snoot-boop, matchboxdoe, matchboxdoe, snoot-boop, the-opinionated-moose, trannsmed, trannsmed, truscum-love, truscum-vivi, this, truscum-vivi, pill0wquirk, truscum-vivi, astrological-tranny, truscum-vivi, truscum-vivi, truscum-vivi, truscum-vivi, this, yeehaw-trans, evergreendiscourse, truscum-love, evergreendiscourse, evergreendiscourse, eilikes, largic, soft-ish-girl, soft-ish-girl, largic, transmedmiku, truscum-love, truscum-love, truscum-love, this, truscum-love, trannsmed, truscum-love, truscum-love, truscum-love, truscum-love, aarontruscum, truscum-love, truscum-love, tyftvv, this, truscum-love, truscum-love, transphobick, thanosjones, thanosjones, spill-the-gender-tea, truscum-love, truscum-love, tired-of-tucutes, tired-of-tucutes, tired-of-tucutes, tired-of-tucutes, lucietian, tired-of-tucutes, this, tired-of-tucutes, thatdudemaison15, truscum-pearl, truscum-love, sidewaysspun, captjackdiscourse, marbles-shall-be-lost, truscum-pearl, trannsmed, truscum-love, truscum-pearl, transmedicalism-saves-lives, beelzeboofo, this, truscum-love, spill-the-gender-tea, pisspasta, lifeofcynch, truscum-love, spill-the-gender-tea, truscum-love, lately-leo, lately-leo, this, spill-the-gender-tea, largic, largic, closetedguyy, closetedguyy, spill-the-gender-tea, closetedguyy, icey-bastard, truscum-love, added:, lifeofcynch, lifeofcynch, lifeofcynch, added:, trannsmed, truscum-pearl, trannsmed, truscum-love, added:, truscum-love, trannsmed, trannsmed, this, trannsmed, truscum-love, truscum-love, truscum-love, transmedicalism-saves-lives, transmedicalism-saves-lives, transmedicalism-saves-lives, truscum-love, this",queer-no-matter-what
